,一级标签,二级标签,药材名,出处,简介,药性,功效,治法,应用,合成,用法用量,使用注意,现代研究,附药
228,止血药,凉血止血药,白茅根,《神农本草经》）,本品为禾本科植物白茅的干燥根茎。全国大部分地区均产。春、秋二季采挖，洗净，晒干，除去须根和膜质叶鞘，捆成小把。切段。本品气微，味微甜。以色白、味甜者为佳。生用或炒炭用。,甘，寒。归肺、胃、膀胱经。,凉血止血，清热利尿。,凉血止血,1.血热咳血，吐血，衄血，尿血本品甘寒入血分，能清血分之热而凉血止血，可用治多种血热出血之证，可单用，或配伍其他凉血止血药。如《妇人良方》治鼻衄出血，《千金翼方》治吐血不止，皆以茅根煎汁或鲜品捣汁服用。若治咳血，《医学衷中参西录》以之与藕同用，均取鲜品煮汁服。又因其性寒降，入膀胱经，能清热利尿，异热下行，故对下焦血热之尿血、血淋之证尤为适宜。如治小便出血，可单用本品煎服；或配伍小蓟、黄芩、血余炭等药。2.热病烦渴，肺热咳嗽，胃热呕吐本品甘寒，善清肺胃之热，降泄火逆。既能清胃热而止呕，又能清肺热而止咳。治疗热病烦渴，可与芦根、天花粉等药配伍；用治胃热呕吐，常与麦冬、竹茹、半夏等同用；用治肺热咳喘，常与桑白皮、地骨皮等同用。3.湿热黄疸，水肿尿少，热淋涩痛本品能清热利尿以除湿退黄、消退水肿、通淋。治湿热黄疸，常与茵陈、栀子等同用；治热淋，水肿，小便不利，可单用本品煎服，也可与其他清热利尿药同用。,,煎服，9～30g。鲜品加倍。止血多炒炭用，清热利尿宜生用。,,本品具有止血、利尿、抗炎等作用。其水煎剂能显著缩短出血和凝血时间；增加负荷小鼠的尿量；且能抑制醋酸所致的小鼠毛细血管通透性的增高，提高小鼠吞噬细胞的吞噬率和吞噬指数。,
229,止血药,凉血止血药,苎麻根,《名医别录》）,本品为荨麻科植物苎麻的干燥根和根茎。我国中部、南部、西南均有产，主产于江苏、山东、山西。冬、春季采挖，洗净，晒干。切段。本品气微，味淡。以切面灰棕色，条匀、坚实者为佳。生用。,甘，寒。归心、肝经。,凉血止血，安胎，清热解毒。,"凉血止血,清热解毒",1.血热出血本品性寒而入血分，能清血分之热而凉血止血，宜于血热出血所致的咳血、吐血、衄血、崩漏、紫癜等以及外伤出血。可单用本品，或配伍其他止血药。2.热盛胎动不安，胎漏下血本品既能止血，又能清热安胎，为安胎之要药。凡胎热不安、胎漏下血，皆可使用。如妊娠胎动下血腹痛，《梅师方》以单味苎麻根煎汤服用；治劳损动胎，腹痛下血，可配伍地黄、阿胶、当归等药。3.痈肿疮毒本品性寒，能清热解毒，可用治热毒痈肿，多以外用为主，常以鲜品捣敷患处。如治痈疽发背，乳痈初起微赤，《梅师方》单用苎麻根捣烂外敷；治丹毒，《肘后方》单用本品煮浓汁外洗。,,煎服，10～30g。外用适量，煎汤外洗，或捣敷。,,本品有止血、抗菌等作用。苎麻根有机酸盐能缩短小鼠断尾后止血时间，使出血部位血小板数增加。苎麻根黄酮苷体外能使兔和小白鼠的怀孕子宫肌收缩力明显减弱，频率减慢，张力减弱。,
230,止血药,凉血止血药,羊蹄,《神农本草经》）,本品为蓼科植物羊蹄或尼泊尔酸模的干燥根。主产于河北。秋季8～9月采挖，洗净，晒干。切片。前者气特殊，味微苦涩；后者气微，味苦涩。以切面色棕黄、味苦者为佳。生用。,苦、涩，寒。归心、肝、大肠经。,凉血止血，解毒杀虫，泻下通便。,凉血止血,1.血热出血本品味苦涩而性寒，既能凉血止血，又能收敛止血，对于血热所致的咳血、吐血、衄血及紫癜等出血证，可用单味内服，也可配伍其他止血药物。如《本草汇言》治热郁吐血，以本品与麦门冬煎汤饮；《永类钤方》治大便下血，用本品与连皮老姜配伍；《江西民间草药》治内痔出血，以本品与猪肉同煮，去药渣饮汤。2.疥癣，疮疡，烧烫伤本品苦寒清泄，既能清热解毒疗疮，又能杀虫止痒，为治癣、疥之良药。用治疥疮，多以鲜品捣敷患处；用治皮癣，《医宗金鉴》以之与枯矾同用，共研末，醋调敷；治烧烫伤，可用鲜品捣敷，或研末油调外涂。3.热结便秘本品苦寒，能泻热通便，功似大黄，作用缓和，素有“土大黄”之称。用治热结便秘，可单味煎服，也可与芒硝同用。,,煎服，10～15g；鲜品30～50g，也可绞汁去渣服用；外用适量。,,本品具有止血、抗菌等作用。羊蹄根水煎剂在体外对金黄色葡萄球菌、炭疽杆菌、乙型溶血性链球菌和白喉杆菌有不同程度抑制作用。羊蹄能抑制血小板抗体作用，促进血小板再生。另外，本品还有抗肿瘤、抗氧化等作用。,附药：土大黄本品为蓼科植物巴天酸模RumexpatientiaL.或皱叶酸模RumexcrispusL.的干燥根。性味苦、辛，凉；归心、肺经。功能凉血止血，杀虫，通便。适用于衄血，咳血，便血，崩漏，疥癣瘙痒，大便秘结。煎服，9～15g。
231,止血药,化瘀止血药,三七,《本草纲目》）,本品为五加科植物三七的干燥根和根茎。主产于云南、广西。秋季花开前采挖，洗净，分开主根、支根及根茎，干燥。支根习称“筋条”，根茎习称“剪口”。本品气微，味淡。以个大、体重、质坚实、断面灰绿色者为佳。切片，或捣碎，或碾细粉用。,甘、微苦，温。归肝、胃经。,散瘀止血，消肿定痛。,,1.咳血，吐血，衄血，便血，尿血，崩漏，外伤出血本品味甘微苦性温，入肝经血分，功善止血，又能祛瘀，有止血不留瘀，化瘀不伤正的特点，对人体内外各种出血，无论有无瘀滞均可应用，尤以有瘀滞者为宜，单味内服外用均有良效。如《濒湖集简方》治吐血、衄血、崩漏，单用本品，米汤调服；《医学衷中参西录》治咳血、吐血、衄血、尿血、便血，与花蕊石、血余炭合用；治外伤出血，可单用本品研末外掺，或与龙骨、血竭、象皮等同用。2.血滞胸腹刺痛，跌扑肿痛本品活血消肿，止痛力强，为治瘀血诸证之佳品，尤为伤科要药。凡跌打损伤，或筋骨折伤，瘀血肿痛，本品皆为首选药物。可单味应用，以三七为末，黄酒或白开水送服；若皮破者，亦可用三七粉外敷。治疗血滞胸腹刺痛，配伍延胡索、川芎、郁金等活血行气药，则活血定痛之功更著。用治痈疽肿痛亦有良效，如《本草纲目》治无名痈肿，疼痛不已，以本品研末，米醋调涂；治痈疽溃烂，常与乳香、没药、儿茶等同用。,,煎服，3～9g；研末吞服，1次1～3g。外用适量。,孕妇慎用。阴虚血热之出血不宜单用。,本品能缩短出血和凝血时间，具有抗血小板聚集及溶栓作用；促进多功能造血干细胞的增殖，具有造血作用；降低血压，减慢心率，对各种药物诱发的心律失常均有保护作用；降低心肌耗氧量和氧利用率，扩张脑血管，增强脑血管流量；提高体液免疫功能。此外，还具有镇痛、抗炎、改善学习记忆、抗疲劳、抗衰老、抗肿瘤、调节血脂等作用。,附药：菊叶三七、景天三七1.菊叶三七本品为菊科植物菊三七Gynurasegetum（Lour.）Merr.的根或全草，民间习称土三七。性味甘、微苦，平；归肝、胃经。功能散瘀止血，解毒消肿。适用于吐血，衄血，外伤出血，跌打伤痛，痈肿疮疡，蛇虫咬伤。煎服3～10g。外用适量。2.景天三七本品为景天科植物景天三七SedumaizoonL.的根或全草。性味甘、微酸，平；归心、肝经。功能散瘀止血，养血安神，解毒消肿。适用于吐血，咳血，衄血，尿血，便血，紫癜，崩漏，外伤出血，跌打伤痛，心悸失眠，烦躁不安，疮肿，蜂蝎蜇伤。煎服，15～30g。外用适量。
232,止血药,化瘀止血药,茜草,《神农本草经》）,本品为茜草科植物茜草的干燥根及根茎。主产于陕西、河北、山东、河南、安徽。春、秋二季采挖，除去泥沙，干燥。切厚片或段。本品气微，味微苦，久嚼刺舌。以切面色黄红者为佳。生用或炒炭用。,苦，寒。归肝经。,凉血，祛瘀，止血，通经。,,1.吐血，衄血，崩漏，外伤出血本品味苦性寒，善走血分，既能凉血止血，又能化瘀止血，故可用于血热妄行或血瘀脉络之出血证，对于血热夹瘀之出血尤为适宜。如治吐血不止，可单用本品为末煎服；治衄血，可与黄芩、侧柏叶等同用；治血热崩漏，常配生地、生蒲黄等；治血热尿血，常与小蓟、白茅根等同用。若与黄芪、白术、山茱萸等同用，也可用于气虚不摄的崩漏下血，如固冲汤（《医学衷中参西录》）。2.瘀阻经闭，风湿痹痛，跌扑肿痛本品主入肝经，能活血通经，故可用治血滞闭经、风湿痹痛、跌打损伤之证，尤为妇科调经要药。如《本草纲目》治血滞经闭，单用本品，加酒煎服，亦可与桃仁、红花、当归等同用；治风湿痹证，可单用浸酒服，或配伍鸡血藤、海风藤、延胡索等药；治跌打损伤，可单味泡酒服，或与三七、乳香、没药等同用。,固冲汤,煎服，6～10g。止血炒炭用，活血通经生用或酒炒用。,孕妇慎用。,本品有明显的促进血液凝固和抗炎作用。其温浸液能缩短家兔复钙时间、凝血酶原时间及白陶土部分凝血活酶时间，茜草炭的作用强于茜草。茜草醇提物灌胃，可抑制角叉菜胶所致大鼠足肿胀及小鼠醋酸炎症性渗出。另外还有抗肿瘤、抗氧化等作用。,
233,止血药,化瘀止血药,蒲黄,《神农本草经》）,本品为香蒲科植物水烛香蒲、东方香蒲或同属植物的干燥花粉。主产于浙江、江苏、山东、安徽、湖北。夏季采收蒲棒上部的黄色雄花序，晒干后碾轧，筛取花粉。剪取花后，晒干，成为带有雄花的花粉，即为草蒲黄。本品气微、味淡。以粉细、体轻、色鲜黄、滑腻感强者为佳。生用或炒炭用。,甘，平。归肝、心包经。,止血，化瘀，利尿通淋。,,1.吐血，衄血，咳血，崩漏，外伤出血本品甘平，长于收敛止血，兼有活血行瘀之功，为止血行瘀之良药，有止血不留瘀的特点，对出血证无论属寒属热，有无瘀滞，均可应用，但以属实夹瘀者尤宜。用治吐血、衄血、咳血、尿血、崩漏等，可单用冲服，亦可配伍其他止血药。如《圣惠方》治鼻衄不止，以之与黄芩、竹茹同用；若治月经过多，漏下不止，可配伍艾叶、侧柏叶、山茱萸等药；治外伤出血，可单用外掺伤口。2.血滞经闭痛经，胸腹刺痛，跌扑肿痛本品味辛，能活血通经，祛瘀止痛，凡跌打损伤、痛经、心腹疼痛等瘀血作痛者均可应用，尤为妇科所常用。如《塞上方》治跌打损伤，单用蒲黄末，温酒服；若治心腹刺痛、产后瘀阻腹痛、痛经等，常与五灵脂同用，如失笑散（《和剂局方》）。3.血淋涩痛本品既能止血，又能利尿通淋，故可用治血淋涩痛，常与生地、冬葵子、石韦等同用。,失笑散,煎服，5～10g，包煎。外用适量，敷患处。止血多炒炭用，化瘀、利尿多生用。,孕妇慎用。,本品有抗血栓形成、止血、抗心肌缺血、抗脑缺血等作用。生蒲黄具有延长小鼠凝血时间，而炒蒲黄和蒲黄炭则能缩短小鼠凝血时间，无促纤溶酶活性。蒲黄可抑制大鼠动静脉环路血栓的形成，使血栓湿重降低。另外还有调脂作用。,
234,止血药,化瘀止血药,花蕊石,《嘉祐本草》）,本品为变质岩类岩石蛇纹大理岩。主产于陕西、河南、河北、江苏。采挖后，除去杂石和泥沙，洗净，干燥。本品气微，味淡。以质坚硬、色白带“彩晕”者为佳。砸成碎块用，或煅用。,酸、涩，平。归肝经。,化瘀止血。,化瘀止血,1.咳血，吐血，外伤出血本品味酸涩性平，既能收敛止血，又能化瘀行血，适用于吐血、咳血、外伤出血等兼有瘀滞的各种出血之证。治瘀滞吐血，《十药神书》单用本品煅为细末，用酒或醋和服；治咳血，可与白及、血余炭等合用；治外伤出血，《和剂局方》单味研末外敷伤口。2.跌扑伤痛本品化瘀行血，用治跌打损伤，瘀血肿痛，可与三七、血竭、刘寄奴等药同用。,,4.5～9g，多研末吞服。外用适量，研末外掺或调敷。,孕妇慎用。,本品有止血作用。其水煎剂可缩短小鼠凝血时间和出血时间，减少出血量，炮制后止血作用略有增强。,
235,止血药,收敛止血药,白及,《神农本草经》）,本品为兰科植物白及的干燥块茎。主产于贵州、四川、湖南、湖北。夏、秋二季采挖，除去须根，洗净，置沸水中煮或蒸至无白心，晒至半干，除去外皮，晒干。切薄片。本品气微，味苦，嚼之有黏性。以切面色白、角质样者为佳。生用。,苦、甘、涩，微寒。归肺、胃、肝经。,收敛止血，消肿生肌。,消肿生肌,1.咳血，吐血，外伤出血本品味涩质黏，为收敛止血之要药，可用治体内外诸出血证。治诸内出血证，《吉人集验方》单味研末，糯米汤调服。因其主入肺、胃经，故尤多用于肺胃出血之证。用治咳血，可配伍藕节、枇杷叶等药；用治吐血，可与茜草、生地、牛膝等煎服；用治外伤或金创出血，可单味研末外掺或水调外敷，或与白蔹、黄芩、龙骨等研细末，掺疮口上。2.疮疡肿毒，皮肤皲裂，烧烫伤本品寒凉苦泄，能泄血中壅滞；味涩质黏，能敛疮生肌，为外疡消肿生肌的常用药。对于疮疡，无论未溃或已溃均可应用。若疮疡初起，可单用本品研末外敷，或与银花、皂刺、乳香等同用，如内消散（《外科正宗》）；若疮痈已溃，久不收口者，以之与黄连、浙贝母、轻粉等为末外敷，如生肌干脓散（《证治准绳》）。治手足皲裂，可以之研末，麻油调涂，能促进裂口愈合；治烧烫伤，可以本品研末，用油调敷，或以白及粉、凡士林调膏外用，能促进生肌结痂。,"内消散,生肌干脓散",煎服，6～15g；研末吞服3～6g。外用适量。,不宜与川乌、制川乌、草乌、制草乌、附子同用。,本品有止血、促进伤口愈合、抗胃溃疡等作用。白及煎剂可明显缩短出血和凝血时间，其止血的作用与所含胶质有关。白及粉对胃黏膜损伤有明显保护作用，对实验性犬胃及十二指肠穿孔有明显治疗作用，可迅速堵塞穿孔，阻止胃及十二指肠内容物外漏并加大网膜的遮盖；对实验性烫伤、烧伤动物模型能促进肉芽生长，促进疮面愈合。另外还有抗肿瘤、抗菌作用。,
236,止血药,收敛止血药,仙鹤草,《图经本草》）,本品为蔷薇科植物龙芽草的干燥地上部分。主产于浙江、江苏、湖北。夏、秋二季茎叶茂盛时采割，除去杂质，晒干。切段。本品气微，味微苦。以茎红棕色、质嫩、叶多者为佳。生用。,苦、涩，平。归心、肝经。,收敛止血，截疟，止痢，解毒，补虚。,,1.咳血，吐血，尿血，便血，崩漏下血本品味涩收敛，功能收敛止血，广泛用于全身各部位的出血证。因其药性平和，大凡出血而无瘀滞者，无论寒热虚实，皆可应用。如治血热妄行之出血证，可与生地、侧柏叶、牡丹皮等药同用；若用于虚寒性出血证，可与党参、炮姜、艾叶等药同用。2.疟疾寒热本品有截疟之功，治疗疟疾寒热，可单以本品研末，于疟发前2小时吞服，或水煎服。3.血痢，久泻久痢本品味涩收敛，能涩肠止泻痢。因其药性平和，兼能补虚，又能止血，故对于血痢及久病泻痢尤为适宜。如《岭南采药录》单用本品水煎服，治疗赤白痢，也可配伍其他药物。4.痈肿疮毒本品能解毒消肿，可用治痈肿疮毒，单用或配伍其他清热解毒药。5.阴痒带下本品能解毒杀虫止痒，可用治阴痒带下，常与苦参、白鲜皮、黄柏等煎汤外洗。6.脱力劳伤本品有补虚强壮的作用，可用治劳力过度所致的脱力劳伤，症见神疲乏力、面色萎黄而纳食正常者，常与大枣同煮，食枣饮汁。若气血亏虚，神疲乏力、头晕目眩者，可与党参、熟地、龙眼肉等同用。,,煎服，6～12g。外用适量。,,本品具有抗炎、抗肿瘤、镇痛等作用。仙鹤草乙醇提取物灌胃，可以抑制二甲苯致小鼠耳肿胀。仙鹤草水煎液对荷瘤小鼠IL-2活性有增强作用，降低S180移植肿瘤重量。另外本品还有降糖、降压等作用。,
237,止血药,收敛止血药,紫珠叶,《本草拾遗》）,本品为马鞭草科植物杜虹花的干燥叶。主产于广东、广西。夏、秋二季枝叶茂盛时采摘，干燥，切段。本品气微，味微苦涩。以叶片完整、质嫩者为佳。生用。,苦、涩，凉。归肝、肺、胃经。,凉血收敛止血，散瘀解毒消肿。,,1.衄血，咳血，吐血，便血，崩漏，外伤出血本品味苦涩而性凉，既能收敛止血，又能凉血止血，适用于各种内外伤出血，尤多用于肺胃出血。可单独应用，也可与其他止血药同用。如治咳血、衄血、吐血，可与大蓟、白及等同用；治尿血、血淋，可与小蓟、白茅根等同用；治便血、痔血，可与地榆、槐花等同用；治外伤出血，可单用捣敷或研末敷掺，或以纱布浸紫珠液覆盖压迫局部。2.热毒疮疡，水火烫伤本品苦涩性凉，有清热解毒敛疮之功。治热毒疮疡，可单用鲜品捣敷，并煮汁内服，也可配伍其他清热解毒药物。治烧烫伤，用本品研末撒布患处，或用本品煎煮滤取药液，浸湿纱布外敷。,,煎服，3～15g；研末吞服1.5～3g。外用适量，敷于患处。,,本品有止血、促进组织愈合、抗菌等作用。紫珠叶水煎剂灌胃给药，可缩短小鼠凝血时间、出血时间，增高血小板数。对金黄色葡萄球菌、白色念珠菌、痢疾杆菌、伤寒杆菌等均有抑制作用。,附药：大叶紫珠本品为马鞭草科植物大叶紫珠CallicarpamacrophyllaVahl的干燥叶或带叶嫩枝。性味辛、苦，平；归肝、肺、胃经。功能散瘀止血，消肿止痛。适用于衄血，咳血，吐血，便血，外伤出血，跌扑肿痛。煎服，15～30g。外用适量，研末敷于患处。
238,止血药,收敛止血药,棕榈炭,《本草拾遗》）,本品为棕榈科植物棕榈的干燥叶柄。主产于湖南、四川、江苏、浙江。采棕时割取旧叶柄下延部分和鞘片，除去纤维状的棕毛，晒干。煅炭用。本品略具焦香气，味苦涩。以表面黑褐色至黑色，有光泽，触之有黑色炭粉者为佳。,苦、涩，平。归肝、肺、大肠经。,收敛止血。,,吐血，衄血，尿血，便血，崩漏本品药性平和，味苦而涩，为收敛止血之良药，广泛用于各种出血病证，尤多用于崩漏。因其收敛性强，故以治出血而无瘀滞者为宜。可单味应用，也常与血余炭、仙鹤草、侧柏叶等同用。若属血热妄行之吐血、咳血，可与小蓟、栀子等同用，如十灰散（《十药神书》）；若虚寒性崩漏下血，常与艾叶、炮姜等同用。此外，本品苦涩收敛，也能止泻止带，尚可用于久泻久痢，妇人带下。,十灰散,煎服，3～9g。,出血兼有瘀滞者不宜使用。,本品有止血作用。陈棕皮炭、陈棕炭及陈棕的水煎剂、陈棕炭混悬剂灌胃给药，均能缩短小鼠出血、凝血时间。,
239,止血药,收敛止血药,血余炭,《神农本草经》）,本品为人发制成的炭化物。全国大部分地区均产。取头发，除去杂质，碱水洗去油垢，清水漂净，晒干，焖煅成炭，放凉。本品有焦发气，味苦。以体轻、色黑、光亮者为佳。,苦，平。归肝、胃经。,收敛止血，化瘀，利尿。,,1.吐血，咳血，衄血，血淋，尿血，便血，崩漏，外伤出血发乃血之余，善入血分，并以炭入药，故有收敛止血之功，且能化瘀，有止血而不留瘀的特点，可用于各种出血之证，无论寒热虚实皆可。可单用本品，温水调服；亦可外用，掺敷出血部位，如治鼻衄，可直接吹入鼻中。治咳血、吐血，常与花蕊石、三七等同用，如化血丹（《医学衷中参西录》）。治血淋，常以之配伍蒲黄、生地、甘草；若治便血，可与地榆、槐花等同用；用治崩漏，可单用本品，或与艾叶、藕节等同用。2.小便不利本品苦降下行，能化瘀利窍，通利水道，故可用治小便不利，常与滑石、白鱼同用，如滑石白鱼散（《金匮要略》）。,"化血丹,滑石白鱼散",煎服，5～10g。外用适量。,,本品能明显缩短出、凝血时间及血浆复钙时间，血余炭煎剂对金黄色葡萄球菌、伤寒杆菌、甲型副伤寒杆菌及福氏痢疾杆菌有较强的抑制作用。,
240,止血药,收敛止血药,藕节,《药性本草》）,本品为睡莲科植物莲的干燥根茎节部。主产于浙江、安徽、江苏。秋、冬二季采挖根茎藕，切取节部，洗净，晒干，除去须根。本品气微，味微甘、涩。以表面色灰黄、断面色白者为佳。生用或炒炭用。,甘、涩，平。归肝、肺、胃经。,收敛止血，化瘀。,,吐血，咳血，衄血，尿血，崩漏本品味涩质黏而性收敛，既能收敛止血，又兼能化瘀，有止血而不留瘀的特点，适用于各种出血病证，尤善治咳血、衄血、吐血等上部出血。如《药性论》治吐血、衄血不止，以鲜藕捣汁饮。本品药力较弱，常入复方中使用。治血淋、尿血，常与小蓟、通草、滑石等同用，如小蓟饮子（《济生方》）。,小蓟饮子,煎服，9～15g。,,本品能缩短凝血时间。,
