,一级标签,二级标签,药材名,出处,简介,药性,功效,治法,应用,合成,用法用量,使用注意,现代研究,附药
102,泻下药,峻下逐水药,甘遂,《神农本草经》）,本品为大戟科植物甘遂的干燥块根。主产于陕西、河南、山西。春季开花前或秋末茎叶枯萎后采挖，除去外皮，晒干。本品气微，味微甘而辣。以肥大、色白、粉性足者为佳。生用或醋炙用。,苦，寒；有毒。归肺、肾、大肠经。,泻水逐饮，消肿散结。,消肿散结,1.水肿胀满，胸腹积水，痰饮积聚，气逆咳喘，二便不利本品苦寒性降，泻下逐饮力峻，药后可连续泻下，使潴留水饮排出体外。凡水肿、大腹鼓胀、胸胁停饮，正气未衰者，均可用之。可单用研末服，或与牵牛子同用；或与大戟、芫花为末，枣汤送服，如十枣汤（《伤寒论》）。若与大黄、阿胶配伍，可用治妇人少腹满如敦状，小便微难而不渴，如大黄甘遂汤（《金匮要略》）。2.风痰癫痫本品尚有逐痰涎作用。《济生方》以甘遂为末，入猪心煨后，与朱砂末为丸服，用于风痰癫痫之证。3.痈肿疮毒本品外用能消肿散结，治疮痈肿毒，可用甘遂末水调外敷。,"十枣汤,大黄甘遂汤",0.5～1.5g。炮制（醋炙减低毒性）后多入丸散用。外用适量，生用。,孕妇及虚弱者禁用。不宜与甘草同用。,甘遂能刺激肠管，增加肠蠕动，造成峻泻。生甘遂作用较强，毒性亦较大，醋制后其泻下作用和毒性均有减轻。甘遂萜酯A、B有镇痛作用。甘遂的乙醇提取物给妊娠豚鼠腹腔或肌内注射，均有引产作用。甘遂的粗制剂对小鼠免疫系统的功能表现为明显的抑制作用。所含甘遂素A、B有抗白血病的作用。3.不良反应甘遂的毒性作用较强，连续静脉给药7天，可见心、肝、肾的中毒性组织学改变。甘遂注射液有很强的溶血作用。本品内服过量，其中毒反应为腹痛，剧烈腹泻水样便，呈里急后重感；如服量较多，可出现霍乱样米汤状大便，并有恶心、呕吐、头晕、头痛、心悸、血压下降、脱水、呼吸困难、脉搏细弱、体温下降、谵语、发绀等症状；可因呼吸循环衰竭致死。,
103,泻下药,峻下逐水药,京大戟,《神农本草经》）,本品为大戟科植物大戟的干燥根。主产于河北、山西、甘肃、山东、江苏。秋、冬二季采挖，洗净，晒干。本品气微，味微苦涩。以切面白色者为佳。生用或醋煮用。,苦，寒；有毒。归肺、脾、肾经。,泻水逐饮，消肿散结。,消肿散结,1.水肿胀满，胸腹积水，痰饮积聚，气逆咳喘，二便不利本品泻水逐饮作用类似甘遂而力稍逊，多治水肿、鼓胀而正气未衰者。《活法机要》用大戟与大枣同煮，去大戟不用，食枣，治水肿腹水。或与甘遂、芫花等峻下逐水药同用，如十枣汤（《伤寒论》）、舟车丸（《景岳全书》）。2.痈肿疮毒，瘰疬痰核本品能消肿散结，内服外用均可。治热毒痈肿疮毒，可鲜用捣烂外敷。治痰火凝聚的瘰疬痰核，可配伍夏枯草、玄参、浙贝母等药。,十枣汤,煎服，1.5～3g；入丸散服，每次1g；内服醋炙用，以减低毒性。外用适量，生用。,孕妇及虚弱者禁用。不宜与甘草同用。,本品乙醚和热水提取物有刺激肠管而异泻的作用；对妊娠离体子宫有兴奋作用；能扩张毛细血管，对抗肾上腺素的升压作用。3.不良反应京大戟毒性成分主要为二萜醇酯类，其对皮肤、口腔及胃肠黏膜有强烈的刺激性，具体表现为口腔咽喉有灼烧感，以及恶心、呕吐、腹痛、腹泻，严重的吐泻续而异致水液、电解质、酸碱平衡的紊乱，甚至出现休克。中毒严重者可引起呼吸麻痹、抑制，甚至呼吸衰竭。,附药：红大戟本品为茜草科植物红大戟knoxiavaierianoidesThoteletPitard的根。又名红芽大戟、广大戟。性味苦、寒，有小毒；归肺、脾、肾经。功能泻水逐饮，消肿散结。适用于水肿胀满，胸腹积水，痰饮积聚，气逆喘咳，二便不利，痈肿疮毒，瘰疬痰核。煎服，1.5～3g；入丸散服，每次1g；内服醋炙用，以减低毒性。外用适量，生用。孕妇及虚弱者禁用；不宜与甘草同用。
104,泻下药,峻下逐水药,芫花,《神农本草经》）,本品为瑞香科植物芫花的干燥花蕾。主产于安徽、江苏、浙江、山东、福建。春季花未开放时采收，除去杂质，干燥。本品气微，味甘、微辛。以花蕾多而整齐、色淡紫者为佳。生用或醋炙用。,苦、辛，温；有毒。归肺、脾、肾经。,泻水逐饮，祛痰止咳；外用杀虫疗疮。,,1.水肿胀满，胸腹积水，痰饮积聚，气逆咳喘，二便不利本品泻水逐饮作用与甘遂、京大戟相似而力稍逊，但以兼能祛痰止咳见长。故适用于胸胁停饮所致的喘咳、胸胁引痛、心下痞鞕及水肿、鼓胀等证。常与甘遂、京大戟等同用，如十枣汤（《伤寒论》）、舟车丸（《景岳全书》）等。2.疥癣秃疮，痈肿，冻疮本品外用能杀虫疗疮，用治头疮，白秃，顽癣，痈肿，冻疮。治皮肤病可单用研末，或配雄黄用猪脂调敷。治痈肿，《千金要方》用本品研末，胶和如粥敷之。,十枣汤,煎服，1.5～3g；研末吞服，1次0.6～0.9g，1日1次；内服醋炙用，以减低毒性。外用适量，生用。,孕妇及虚弱者禁用。不宜与甘草同用。,芫花素能刺激肠黏膜引起剧烈的水泻和腹痛。口服芫花煎剂可引起尿量增加，排钠量亦有增加。醋制芫花的醇水提取物，对肺炎杆菌、溶血性链球菌、流行性感冒杆菌有抑制作用，水浸液对黄癣菌、大芽孢菌、铁锈色小芽孢菌、星状皮癣菌等皮肤真菌有抑制作用，芫花素能引起狗的子宫收缩；芫花还有镇静、镇咳、祛痰作用。3.不良反应芫花的毒性成分主要是芫花中油脂状物，其对皮肤和黏膜有强烈的刺激性，芫花中的二萜原酸酯类亦是毒性成分。长期、大量服用芫花可出现严重的溶血和弥散性血管内凝血，心、肾、肝、肾上腺皮质等均可发生器质性病变。,附药：狼毒本品为瑞香科植物瑞香狼毒StellerachamaejasmeI.的根。主产于东北、西北、河北等地。性味苦、辛，平，有毒；归肺、脾、肝经。功能泻水逐饮，破积杀虫。适用于水肿腹胀，痰食虫积，心腹疼痛，癥瘕积聚，结核，疥癣。煎服，1～3g；或入丸、散。外用适量，研末调敷，或醋磨汁涂，或取鲜根去皮捣烂敷。本品有毒，内服宜慎，过量服用可引起中毒。体质虚弱及孕妇禁用。不宜与密陀僧同用。
105,泻下药,峻下逐水药,商陆,《神农本草经》）,本品为商陆科植物商陆或垂序商陆的干燥根。我国大部分地区均产，主产于河南、安徽、湖北。秋季至次春采挖，除去须根和泥沙，切成块或片，晒干或阴干。本品气微，味稍甜，久嚼麻舌。以片大、色黄白、有罗盘纹者为佳。生用或醋炙用。,苦，寒；有毒。归肺、脾、肾、大肠经。,逐水消肿，通利二便；外用解毒散结。,,1.水肿胀满，二便不利本品苦寒性降，能通利二便而逐水湿，故可用治水肿鼓胀，大便秘结，小便不利的实证。单用有效，或与鲤鱼、赤小豆煮食，或与泽泻、茯苓皮等利水药同用，如疏凿饮子（《济生方》）。亦可将本品捣烂，入麝香少许，贴于脐上，以利水消肿。2.痈肿疮毒本品外用有解毒消肿散结的作用。治疮痈肿痛初起者，可用鲜商陆根，酌加食盐，捣烂外敷，或煎汤熏洗。,疏凿饮子,煎服，3～9g。外用适量，煎汤熏洗。,孕妇禁用。,本品有明显的祛痰作用；生物碱部分有镇咳作用；其根提取物有利尿作用，有研究表明，本品的利尿作用与其剂量有关，小剂量利尿，而大剂量反使尿量减少；对痢疾杆菌、流感杆菌、肺炎双球菌及部分皮肤真菌有不同程度的抑制作用。3.不良反应本品有毒，过量可引起中毒，出现恶心呕吐、腹泻、头痛、语言不清，躁动，肌肉抽搐等症状；严重者血压下降，昏迷，瞳孔散大，心脏和呼吸中枢麻痹而死亡。,
106,泻下药,峻下逐水药,牵牛子,《名医别录》）,本品为旋花科植物裂叶牵牛或圆叶牵牛的干燥成熟种子。全国大部分地区均产。秋末果实成熟、果壳未开裂时采割植株，晒干，打下种子，除去杂质。本品气微，味辛、苦，有麻感。以粒大、饱满者为佳。生用或炒用，用时捣碎。,苦，寒；有毒。归肺、肾、大肠经。,泻水通便，消痰涤饮，杀虫攻积。,,1.水肿胀满，二便不通本品苦寒，其性降泄，能通利二便以排泄水湿，其逐水作用虽较甘遂、京大戟稍缓，但扔属峻下逐水之品，以水湿停滞，正气未衰者为宜。治水肿鼓胀，二便不利者，《千金要方》单用研末服；《儒门事亲》以之与茴香为末，姜汁调服；病情较重者，可与甘遂、京大戟等同用，以增强泻水逐饮之力，如舟车丸（《景岳全书》）。2.痰饮积聚，气逆喘咳本品能泻肺气，消痰涤饮，用治肺气壅滞，痰饮咳喘，面目浮肿者，可与大黄、槟榔等配伍。3.虫积腹痛本品能杀虫攻积，并可借其泻下通便作用以排除虫体。治蛔虫、绦虫及虫积腹痛者，可与槟榔、使君子同用，研末送服，以增强去积杀虫之功。,舟车丸,煎服，3～6g。入丸散服，每次1.5～3g。本品炒用药性减缓。,孕妇禁用。不宜与巴豆、巴豆霜同用。,牵牛子苷在肠内遇胆汁及肠液分解出牵牛子素，刺激肠道，增进蠕动，异致强烈的泻下；其黑丑、白丑泻下作用无区别。在体外实验，黑丑、白丑对猪蛔虫尚有一定驱虫效果。3.不良反应本品能引起肠黏膜充血而诱发子宫出血及月经过多，并易引发流产或早产。大剂量可刺激胃肠黏膜，表现为呕吐、腹痛、腹泻及黏液血大便，还可刺激肾脏，出现血尿。严重者可损及中枢神经系统，发生语言障碍、昏迷等。,
107,泻下药,峻下逐水药,巴豆霜,《神农本草经》）,本品为大戟科植物巴豆干燥净仁的炮制加工品。主产于四川、广西、云南。秋季果实成熟时采收，堆置2～3天，摊开，干燥。去皮取净仁，照制霜法制霜，或取仁研细后，测定脂肪油含量，加适量的淀粉，使脂肪油含量符合规定应为180%～200%，混匀，即得巴豆霜。本品气微，味辛辣。以粒度均匀、疏松、色淡黄粉末者为佳。,辛，热；有大毒。归胃、大肠经。,峻下冷积，逐水退肿，豁痰利咽；外用蚀疮。,,1.寒积便秘本品辛热，能峻下冷积，开通肠道闭塞。可单用巴豆霜装入胶囊，或配大黄、干姜制丸服，用于寒邪食积，阻结肠道，大便不通，腹满胀痛，病起急骤，气血未衰者，如三物备急丸（《金匮要略》）。2.小儿乳食停积本品制霜力稍缓，且峻药轻投，可泻下利水，祛痰消积。常与胆南星、朱砂、六神曲等同用，用于小儿痰壅、乳食停积，甚则惊悸者。3.腹水鼓胀，二便不通本品峻泻，有较强的逐水退肿作用。《肘后方》以之与杏仁为丸服，治腹水鼓胀。近代用本品配绛矾、神曲为丸，即含巴绛矾丸，用治晚期血吸虫病肝硬化腹水。4.喉风，喉痹本品能祛痰利咽以利呼吸。治喉风，或喉痹痰涎壅塞气道，呼吸困难，甚则窒息欲死者，可单用本品；近代治疗白喉及喉炎引起喉梗阻，用巴豆霜吹入喉部，引起呕吐，排出痰涎，使梗阻症状得以缓解。或与贝母、桔梗同用，治痰涎壅塞、胸膈窒闷、肢冷汗出之寒实结胸者，如三物小白散（《伤寒论》）。5.痈肿脓成未溃，疥癣恶疮，疣痣本品外用有蚀腐肉、疗疮毒作用。常与乳香、没药、木鳖子等熬膏外敷，以蚀腐皮肤，促进破溃排脓，治痈肿成脓未溃者；或以油调本品、雄黄、轻粉末，外涂以治疥癣恶疮。,"三物备急丸,三物小白散",0.1～0.3g，多入丸散用。外用适量。,孕妇及虚弱者禁用。不宜与牵牛子同用。,巴豆油外用，对皮肤有强烈刺激作用。口服半滴至1滴，即能产生口腔、咽及胃黏膜的烧灼感及呕吐，短时期内可有多次大量水泻，伴有剧烈腹痛和里急后重；巴豆煎剂对金黄色葡萄球菌、白喉杆菌、流感杆菌、绿脓杆菌均有不同程度的抑制作用；巴豆油有镇痛及促血小板凝集作用。巴豆提取物对小鼠腹水型与艾氏腹水癌有明显抑制作用；巴豆油、巴豆树脂和巴豆醇脂类有弱性致癌活性。3.不良反应本品具有强烈的毒性，其含巴豆毒蛋白及巴豆油。巴豆毒蛋白是一种细胞原浆毒，能溶解红细胞，并使局部细胞坏死；巴豆油系一种峻泻剂，对胃肠道黏膜具有强烈的刺激和腐蚀作用，可引起恶心、呕吐与腹痛，重则发生出血性胃肠炎，大便内可带血和黏膜。对肾亦有刺激作用。皮肤接触巴豆油后，能引起急性皮炎。中毒表现：症状为咽喉肿痛、呕吐、肠绞痛、腹泻，甚则腐蚀肠壁，出现霍乱样米汤样大便，头痛，眩晕，皮肤冷湿，脱水，呼吸或循环衰竭而死亡。外用巴豆霜可产生接触性皮炎，局部烧灼成脓疱状红疹，水疱等症状。,附药：巴豆本品为大戟科植物巴豆CrotontigliumL.的干燥成熟果实。秋季果实成熟时采收，堆置2～3天，摊开，干燥。去皮，取净仁用。性味辛、热，有大毒；归胃、大肠经。外用蚀疮。适用于恶疮疥癣，疣痣。外用适量，研末涂患处，或捣烂以纱布包擦患处。孕妇及虚弱者禁用；不宜与牵牛子同用。本品专供外用，不作内服。
108,泻下药,峻下逐水药,千金子,《蜀本草》）,本品为大戟科植物续随子的干燥成熟种子。主产于河北、浙江、四川。夏、秋二季果实成熟时采收，除去杂质，干燥。本品气微，味辛。以色白或淡黄、富油质者为佳。生用或制霜用。,辛，温；有毒。归肝、肾、大肠经。,泻下逐水，破血消癥；外用疗癣蚀疣。,泻下逐水,1.二便不通，水肿，痰饮，积滞胀满本品其性峻猛，能泻下逐水消肿，宜用于二便不通，水肿，痰饮，积滞胀满之实证。单用有效，或配大黄，酒水为丸服，或与防己、槟榔、葶苈子等药同用，以增强逐水消肿之功。2.血瘀经闭，癥瘕本品有破瘀血、消癥瘕、通经脉的作用。治瘀滞经闭者，可与当归、川芎、红花等同用。治癥瘕痞块，可与三棱、莪术、大黄等同用。3.顽癣，赘疣本品外用可疗癣蚀疣。治顽癣、恶疮肿毒及毒蛇咬伤等，可内服、外用。,,生千金子，1～2g，去壳，去油用，多入丸散服；外用适量，捣烂敷患处。千金子霜0.5～1g，多入丸散服；外用适量。,孕妇及虚弱者禁用。,种子中的脂肪油，新鲜时无味，无色，但很快变恶臭而有强辛辣味，对胃肠有刺激，可产生峻泻，作用强度为蓖麻油的3倍，致泻成分为千金子甾醇。3.不良反应千金子所含毒性成分为千金子甾醇、殷金醇棕榈酸酯等。对胃肠有强烈刺激作用，可产生峻泻，对中枢神经系统也有毒。多服或误服可引起中毒，初见头晕、头痛、恶心、剧烈呕吐、心悸、冷汗自出、面色苍白等，严重者出现血压下降、大汗淋漓、四肢厥冷、呼吸浅粗、脉微欲绝等危证。,
109,祛风湿药,祛风寒湿药,独活,《神农本草经》）,本品为伞形科植物重齿毛当归的干燥根。主产于四川、湖北。春初苗刚发芽或秋末茎叶枯萎时采挖，除去须根和泥沙，摊晾至表皮干燥，烘至半干，堆置2～3天，发软后再烘至全干，切片。本品有特异香气，味苦、辛，微麻舌。以根条粗肥，香气浓郁者为佳。生用。,辛、苦，微温。归肾、膀胱经。,祛风除湿，通痹止痛，解表。,,1.风寒湿痹，腰膝疼痛本品辛散苦燥，气香温通，功善祛风湿，止痹痛，为治风湿痹痛主药，凡风寒湿邪所致之痹证，无论新久，均可应用。因其主入肾经，性善下行，“宣肾经之寒湿”，故尤以下半身风寒湿痹为宜。治风寒湿痹，肌肉、腰背、手足疼痛，可与当归、白术、牛膝等同用；若与桑寄生、杜仲、人参等配伍，可治痹证日久正虚，腰膝酸软，关节屈伸不利者，如独活寄生汤（《千金要方》）。2.风寒夹湿头痛本品辛散苦燥温通，能发散风寒湿邪而解表，治外感风寒夹湿所致的头痛头重，一身尽痛，多配羌活、藁本、防风等，如羌活胜湿汤（《内外伤辨惑论》）。3.少阴伏风头痛本品善入肾经而搜伏风，与细辛、川芎等相配，可治风扰肾经，伏而不出之少阴头痛。其祛风湿之功，亦治皮肤瘙痒，内服或外洗皆可。,"独活寄生汤,羌活胜湿汤",煎服，3～10g。外用适量。,,独活有抗炎、镇痛及镇静作用；对血小板聚集有抑制作用；并有降压作用，但不持久；所含香柑内酯、花椒毒素等有光敏及抗肿瘤作用。,
110,祛风湿药,祛风寒湿药,威灵仙,《新修本草》）,本品为毛茛科植物威灵仙、棉团铁线莲或东北铁线莲的干燥根及根茎。主产于辽宁、吉林、黑龙江、山东。秋季采挖，除去泥沙，晒干，切段。本品气微，味辛辣。以条匀，皮黑、肉白、坚实者为佳。生用。,辛、咸，温。归膀胱经。,祛风湿，通经络，止痛，消骨骾。,,1.风湿痹痛本品辛散温通，性猛善走，既能祛风湿，又能通经络而止痛，为治风湿痹痛要药。凡风湿痹痛，肢体麻木，筋脉拘挛，屈伸不利，无论上下皆可应用，尤宜于风邪偏盛，拘挛掣痛，游走不定者。可单用为末服，也可与蕲蛇、当归、附子等配伍。2.骨骾咽喉本品味咸，能软坚而消骨骾，可单用或与砂糖、醋煎后慢慢咽下。《本草纲目》则与砂仁、砂糖煎服。此外，本品通络止痛之功，还可用治跌打伤痛。,,煎服，6～10g。消骨骾可用30～50g。,本品辛散走窜，气血虚弱者慎服。,威灵仙有镇痛抗炎、抗利尿、抗疟、降血糖、降血压、利胆等作用；原白头翁素对革兰阳性及阴性菌和真菌都有较强的抑制作用；煎剂可使食管蠕动节律增强，频率加快，幅度增大，能松弛肠平滑肌；醋浸液对鱼骨刺有一定软化作用，并使咽及食道平滑肌松弛，增强蠕动，促使骨刺松脱；其醇提取物有引产作用。,
111,祛风湿药,祛风寒湿药,徐长卿,《神农本草经》）,本品为萝藦科植物徐长卿的干燥根或根茎。全国大部分地区均产。秋季采挖，除去杂质，阴干，切段。本品气香，味微辛凉。以香气浓者为佳。生用。,辛，温。归肝、胃经。,祛风除湿，止痛，止痒。,,1.风湿痹痛本品味辛性温，具有祛风除湿、通络止痛之功，故常用于风湿痹证，腰膝酸痛等证。治疗风寒湿痹，关节疼痛，筋脉拘挛者，可与防己、威灵仙、木瓜等配伍；肝肾亏虚，寒湿痹阻，腰膝酸软疼痛者，可与杜仲、续断、独活等同用。2.胃痛胀满，牙痛，腰痛，跌扑伤痛，痛经本品具有较强的止痛作用，故常用于各种痛证。治疗寒凝气滞，脘腹疼痛者，可与高良姜、延胡索配伍；治疗龋齿牙痛者，可与细辛、花椒同用；治疗气滞血瘀，月经不调，经行腹痛者，可与川芎、当归、香附等配伍；若治疗跌打伤痛，瘀血内阻者，可与当归、乳香、没药等同用。3.风疹，湿疹本品具有祛风、除湿、止痒之功。治疗风疹湿疹，瘙痒不止者，可单用内服与外洗；亦可与苦参、黄柏、白鲜皮等配伍。,,煎服，3～12g，后下。,孕妇慎用。,本品有明显的镇静、镇痛、抗菌、抗炎作用。并有改善心脏功能、降血压、降血脂的作用。对肠道平滑肌有解痉作用。,
112,祛风湿药,祛风寒湿药,川乌,《神农本草经》）,本品为毛茛科植物乌头的干燥母根。主产于四川、云南、陕西。6月下旬至8月上旬采挖，除去子根、须根及泥沙，晒干。本品气微，味辛辣、麻舌。以饱满、质坚实、断面色白、无空心者为佳。生用或制后用。,辛、苦，热。归心、肝、肾、脾经。生川乌有大毒，制川乌有毒。,祛风除湿，温经止痛。,温经止痛,1.风寒湿痹，关节疼痛本品辛热苦燥，善于驱逐寒湿、温经止痛，为治寒湿痹痛之佳品，“一切沉寒痼冷之症，用此无不奏效”，尤宜于寒邪偏盛之痹痛。治寒湿侵袭，历节疼痛，不可屈伸者，常与麻黄、芍药、甘草等配伍，如乌头汤（《金匮要略》）；若与草乌、地龙、乳香等同用，可治寒湿瘀血留滞经络，肢体筋脉挛痛，关节屈伸不利，日久不愈者，如小活络丹（《和剂局方》）。2.心腹冷痛，寒疝作痛本品辛散温通，散寒止痛之功显著，故又常用于阴寒内盛之心腹冷痛。治心痛彻背，背痛彻心者，常配赤石脂、干姜、花椒等，如乌头赤石脂丸（《金匮要略》）；治寒疝，绕脐腹痛，手足厥冷者，多与蜂蜜同煎，如大乌头煎（《金匮要略》）。3.跌扑伤痛，麻醉止痛本品止痛作用，可治跌打损伤，骨折瘀肿疼痛，多与自然铜、乳香、地龙等同用。古方又常以本品作为麻醉止痛药，多以生品与生草乌并用，配伍羊踯躅、姜黄等，如整骨麻药方（《医宗金鉴》）；或配生南星、蟾酥等外用以达局部麻醉之效，如外敷麻药方（《医宗金鉴》）。,"乌头汤,小活络丹,乌头赤石脂丸,大乌头煎,整骨麻药方,外敷麻药方",制川乌煎服，1.5～3g，宜先煎、久煎。生品宜外用，适量。,生品内服宜慎，孕妇忌用。制川乌孕妇慎用。不宜与半夏、川贝母、浙贝母、平贝母、伊贝母、湖北贝母、瓜蒌、瓜蒌皮、瓜蒌子、天花粉、白及、白蔹同用。,川乌有明显的抗炎、镇痛作用，有强心作用，但剂量加大则引起心律失常，终致心脏抑制；乌头碱可引起心律不齐和血压升高，还可增强毒毛花苷G对心肌的毒性作用，有明显的局部麻醉作用；乌头多糖有显著降低正常血糖作用；注射液对胃癌细胞有抑制作用。3.不良反应川乌服用不当可引起中毒，其症状为口舌、四肢及全身麻木，流涎，恶心，呕吐，腹泻，头昏，眼花，口干，脉搏减缓，呼吸困难，手足搐搦，神志不清，大小便失禁，血压及体温下降，心律失常，室性期前收缩和窦房停搏等。严重者，可致循环、呼吸衰竭及严重心律失常而死亡。,附药：草乌本品为毛茛科植物北乌头AconitumkusnezoffiiReichb.的干燥根。主产于东北、华北。秋季茎叶枯萎时采挖，除去须根及泥沙，干燥。生用或制后用。本品的药性、功效、应用、用法用量、使用注意与川乌相同，而毒性更强。
