,一级标签,二级标签,药材名,出处,简介,药性,功效,治法,应用,合成,用法用量,使用注意,现代研究,附药
332,平肝息风药,息风止痉药,*麻,《神农本草经》）,本品为兰科植物天麻的干燥块茎。主产于湖北、四川、云南、贵州、陕西。立冬后至次年清明前采挖，冬季茎枯时采挖者名“冬麻”，质量优良；春季发芽时采挖者名“春麻”，质量较差。采挖后，立即洗净，蒸透，敞开低温干燥。本品气微，味甘，久嚼有黏性。以色黄白、角质样、切面半透明者为佳。切薄片生用。,甘，平。归肝经。,息风止痉，平抑肝阳，祛风通络。,祛风通络,1.小儿惊风，癫痫抽搐，破伤风本品主入肝经，功擅息风止痉，且味甘质润，药性平和，故治疗肝风内动，惊痫抽搐，不论寒热虚实，皆可配伍应用。治疗小儿急惊风，可配伍钩藤、全蝎、僵蚕等，如钩藤饮子（《小儿药证直诀》）；治疗小儿脾虚慢惊，则与人参、白术、僵蚕等配伍；用治小儿诸惊，可与全蝎、制南星、僵蚕等同用；治疗破伤风，痉挛抽搐、角弓反张，可与天南星、白附子、防风等药配伍，如玉真散（《外科正宗》）。2.肝阳上亢，头痛眩晕本品既息肝风，又平肝阳，善治多种原因之眩晕、头痛，为止眩晕之良药。治疗肝阳上亢之眩晕、头痛，常与钩藤、石决明、牛膝等同用，如天麻钩藤饮（《杂病证治新义》）；用治风痰上扰之眩晕、头痛，痰多胸闷者，常与半夏、茯苓、白术等健脾燥湿之品同用，如半夏白术天麻汤（《医学心悟》）；治疗头风头痛，头晕欲倒者，可配等量川芎为丸，如天麻丸（《普济方》）。3.手足不遂，肢体麻木，风湿痹痛本品既息内风，又祛外风，并能通经络，止痛。用治中风手足不遂，筋骨疼痛等，可与没药、制乌头、麝香等药配伍。治疗风湿痹痛，肢体麻木，关节屈伸不利者，多与秦艽、羌活、桑枝等祛风湿药同用。,"钩藤饮子,玉真散,天麻钩藤饮,天麻丸",煎服，3～10g。,,本品具有镇静催眠、抗惊厥、改善学习记忆、保护神经元、抗焦虑、抗抑郁、降血压、扩张血管、保护心肌细胞、抗凝血、抗血栓、抗血小板聚集、抗炎、镇痛等作用。并能抗衰老、抗氧化、抗缺氧、抗辐射、保肝、保护胃黏膜、兴奋肠管。天麻多糖还有增强机体非特异性免疫和细胞免疫的作用。,附药：密环菌本品为白蘑科真菌假蜜环菌Armillariellamellea（Vahl.exFr.）Karst.的子实体。性味甘，平；归肝经。功能平肝息风，祛风通络，强筋壮骨。适用于肝阳上亢、头晕头痛、失眠，以及风湿痹证、四肢麻木、腰腿疼痛等。煎服，30～60g。密环菌为天麻种子和块茎均赖于供给营养而生长的一种发光真菌，因其具有与天麻相似的药理作用和临床疗效，故可作为天麻的代用品使用。
333,平肝息风药,息风止痉药,地龙,《神农本草经》）,本品为钜蚓科动物参环毛蚓、通俗环毛蚓、威廉环毛蚓或栉盲环毛蚓的干燥体。前一种习称“广地龙”，后三种习称“沪地龙”。主产于广东、广西、浙江。广地龙春季至秋季捕捉，沪地龙夏季捕捉，及时剖开腹部，除去内脏及泥沙，洗净，切段，晒干或低温干燥。本品气腥，味微咸。以条宽、肉厚者为佳。生用。,咸，寒。归肝、脾、膀胱经。,清热定惊，通络，平喘，利尿。,,1.高热神昏，惊痫抽搐，癫狂本品性寒，善于清热息风、定惊止痉，故适用于热极生风所致的神昏谵语、痉挛抽搐以及小儿惊风、癫狂。治温热病热极生风，神昏、痉挛抽搐之证，多配伍钩藤、牛黄、全蝎等清热、息风止痉药；治疗小儿惊风，高热、惊厥抽搐，可将本品研烂，同朱砂作丸服用；治疗狂躁癫痫，可单用鲜品，加食盐搅拌化水后服用。2.关节痹痛，肢体麻木，半身不遂本品性善走窜，长于通行经络，适用于多种原因异致的经络阻滞、血脉不畅，关节痹痛，肢体麻木。因药性寒凉，故以治疗关节红肿热痛、屈伸不利之热痹多用，可配伍防己、秦艽、忍冬藤等祛风湿热药；如用治风寒湿痹，肢体关节麻木、疼痛尤甚、屈伸不利等症，则应与川乌、草乌、天南星等祛风散寒，通络止痛药配伍，如小活络丹（《和剂局方》）。治疗气虚血滞，中风半身不遂、口眼斜等症，常与黄芪、当归、川芎等补气活血之品配伍，如补阳还五汤（《医林改错》）。3.肺热喘咳本品性寒降泄，长于清肺平喘，用治邪热壅肺，肺失肃降之喘息不止，喉中哮鸣有声者，可单味研末内服，或配伍麻黄、苦杏仁、黄芩等加强清肺化痰、止咳平喘之功；亦可用鲜品水煎去渣后，加冰糖熬膏冲服。4.湿热水肿，小便不利或尿闭不通本品咸寒走下入肾，能清热结而利水道。治疗湿热水肿，可与泽泻、木通、芦根等清热利水药配伍。用于热结膀胱，小便不利，甚则尿闭不通，可单用，或配伍车前子、滑石、萹蓄等利尿通淋之品。此外，本品有降压作用，常用治肝阳上亢型高血压病。,"小活络丹,补阳还五汤",煎服，5～10g。,,本品具有解热、镇静、抗惊厥、抗血栓、抗凝血、降血压、平喘、抗炎、镇痛、抗肝纤维化、抗心律失常、促进创伤愈合、增强免疫、抗肿瘤、利尿、抗菌、兴奋子宫及肠平滑肌作用。,
334,平肝息风药,息风止痉药,全蝎,《蜀本草》）,本品为钳蝎科动物东亚钳蝎的干燥体。主产于河南、山东、湖北、安徽。春末至秋初捕捉，除去泥沙，置沸水或沸盐水中，煮至全身僵硬，捞出，置通风处，阴干。本品气微腥，味咸。以完整、色黄褐、盐霜少者为佳。,辛，平；有毒。归肝经。,息风镇痉，通络止痛，攻毒散结。,,1.肝风内动，痉挛抽搐，小儿惊风，中风口，半身不遂，破伤风本品专入肝经，性善走窜，既平息肝风，又搜风通络，有良好的息风止痉之功，为治痉挛抽搐之要药。用治各种原因之惊风、痉挛抽搐，常与蜈蚣同用；如用治小儿急惊风高热、神昏、抽搐，常与羚羊角、钩藤、天麻等清热、息风止痉之品配伍；用治小儿慢惊风抽搐，常与党参、白术、天麻等益气健脾药同用；用治痰迷癫痫抽搐，可与郁金、白矾等份，研细末服；若治破伤风痉挛抽搐、角弓反张，可与蜈蚣、钩藤、天南星等配伍；治疗风中经络，口眼斜，可与僵蚕、白附子同用，如牵正散（《杨氏家藏方》）。2.风湿顽痹，偏正头痛本品为虫类药，善于搜风、通络止痛，对风寒湿痹日久不愈，筋脉拘挛，甚则关节变形之顽痹，常配伍川乌、蕲蛇、没药等祛风通络、活血舒筋之品。治疗顽固性偏正头痛，多与天麻、蜈蚣、川芎等祛风止痛药同用，亦可单用研末吞服。3.疮疡，瘰疬本品味辛有毒，能以毒攻毒，解毒而散结消肿，治疗诸疮肿毒，可用全蝎、栀子各7个，麻油煎黑去渣，入黄蜡为膏，外敷。《医学衷中参西录》以本品10枚，焙焦，分二次黄酒下，治疗颌下肿硬。《经验方》小金散，以本品配马钱子、半夏、五灵脂等，共为细末，制成片剂，用治瘰疬、瘿瘤。,牵正散,煎服，3～6g。外用适量。,本品有毒，用量不宜过大。孕妇禁用。,本品具有抗癫痫、抗惊厥、镇痛、抗凝血、抗血栓和抗肿瘤等作用。此外，还有降压、抑菌等作用。3.不良反应全蝎用量过大可致头痛头昏、血压升高、心慌心悸、烦躁不安；严重者血压突然下降、呼吸困难、发绀、昏迷，最后多因呼吸麻痹而死亡。过敏体质者还可出现过敏反应，表现为全身性红色皮疹及风团、发热、全身剥脱性皮炎等。此外，还可引起蛋白尿、神经中毒，表现为面部咬肌强直性痉挛。其中毒原因，一是用量过大，二是过敏体质者出现过敏反应。故应严格掌握剂量，过敏体质者忌用。,
335,平肝息风药,息风止痉药,蜈蚣,《神农本草经》）,本品为蜈蚣科动物少棘巨蜈蚣的干燥体。主产于浙江、湖北、湖南、江苏。春、夏二季捕捉，用竹片插入头尾，绷直，干燥。本品气微腥，有特殊刺鼻的臭气，味辛、微咸。以条宽、腹干瘪者为佳。去竹片，洗净，微火焙黄，剪段用。,辛，温；有毒。归肝经。,息风镇痉，通络止痛，攻毒散结。,,1.肝风内动，痉挛抽搐，小儿惊风，中风口，半身不遂，破伤风本品性温，性善走窜，通达内外，有比全蝎更强的息风止痉及搜风通络作用，二者常相须为用，治疗多种原因引起的痉挛抽搐。若治小儿撮口，手足抽搐，可配全蝎、钩藤、僵蚕等。治疗破伤风，角弓反张，多配伍天南星、防风等。2.风湿顽痹，顽固性偏正头痛本品有较强的搜风、通络止痛作用，常与独活、威灵仙、川乌等祛风除湿、通络止痛药同用，治疗顽痹疼痛。对久治不愈的顽固性偏正头痛，可与天麻、川芎、僵蚕等配伍。3.疮疡，瘰疬，蛇虫咬伤本品有毒，能以毒攻毒，味辛又能散结。《拔萃方》以之与雄黄、猪胆汁配伍制膏，外敷治疗恶疮肿毒。若与茶叶共为细末，外敷治疗瘰疬溃烂；此外，还可用治虫蛇咬伤。,,煎服，3～5g。外用适量。,本品有毒，用量不宜过大。孕妇禁用。,本品具有抗惊厥、抗炎、镇痛、抗肿瘤、抗心肌缺血、抑菌、改善微循环、延长凝血时间、降低血黏度等作用。并有溶血和组织胺样作用。3.不良反应蜈蚣所含有毒成分具有溶血作用，并能引起过敏反应。大量蜈蚣能使心肌麻痹，并能抑制呼吸中枢。中毒表现为恶心呕吐、腹痛腹泻、不省人事、心跳缓慢、呼吸困难、体温下降、血压下降等。出现溶血反应时，尿呈酱油色、排黑便、并出现溶血性贫血症状。出现过敏者，全身皮肤出现红色粟粒样皮疹，瘙痒难忍，目赤肿痛，羞明流泪，眼睑可见粟粒样脓点，伴发热、胸闷、纳差等，严重者可出现过敏性休克。另有服用蜈蚣粉致肝功能损害及急性肾功能衰竭者。蜈蚣中毒原因：一是用量过大，二是过敏体质者出现过敏反应。故应严格掌握剂量，过敏体质者忌用。,
336,平肝息风药,息风止痉药,僵蚕,《神农本草经》）,本品为蚕蛾科昆虫家蚕4～5龄的幼虫感染或人工接种白僵菌而致死的干燥体。主产于浙江、江苏。多于春、秋季生产，将感染白僵菌病死的蚕干燥。本品气微腥，味微咸。以肥壮、质硬、色白、断面明亮者为佳。生用或炒用。,咸、辛，平。归肝、肺、胃经。,息风止痉，祛风止痛，化痰散结。,"祛风止痛,化痰散结",1.肝风夹痰，惊痫抽搐，小儿急惊，破伤风本品咸辛平，入肝、肺二经，既能息风止痉，又能化痰定惊，故对惊风、癫痫夹有痰热者尤为适宜。治疗小儿痰热急惊风，常与全蝎、牛黄、胆南星等清热化痰、息风止痉药配伍；治小儿脾虚久泻，慢惊抽搐，又与人参、白术、天麻等益气健脾、息风止痉药同用；用治破伤风痉挛抽搐、角弓反张者，则与全蝎、蜈蚣、钩藤等药配伍。2.中风口眼斜本品味辛行散，有祛风、化痰、通络之效，用于风中经络，口眼斜，痉挛抽搐之证，常与全蝎、白附子同用，如牵正散（《杨氏家藏方》）。3.风热头痛，目赤咽痛，风疹瘙痒本品辛散，入肝、肺二经，有祛外风、散风热、止痛、止痒之功。用治肝经风热上攻之头痛、目赤肿痛、迎风流泪等症，常与桑叶、木贼、荆芥等疏风清热之品配伍；用治风热上攻，咽喉肿痛、声音嘶哑者，可与薄荷、桔梗、甘草等同用；治疗风疹瘙痒，可配伍蝉蜕、薄荷、防风等祛风止痒药，亦可单用研末服用。4.瘰疬痰核，发颐痄腮本品味辛能散，咸能软坚，具有化痰软坚散结之功，可用治痰核瘰疬之证，多与浙贝母、夏枯草、连翘等清热、化痰、散结药同用。治疗发颐、痄腮、乳痈、疔疮，可配伍金银花、板蓝根、蒲公英等清热解毒药。,牵正散,煎服，5～10g。散风热宜生用，其余多制用。,,本品有镇静、催眠、抗惊厥、抗凝血、抗肿瘤、降血糖等作用，对金黄色葡萄球菌、大肠杆菌、绿脓杆菌等有轻度抑制作用。,附药：僵蛹、雄蚕蛾1.僵蛹本品为蚕蛾科昆虫家蚕蛾BombyxmoriLinnaeus的蚕蛹经白僵菌Beauveriabassiana（Bals.）Vaillant发酵的制成品。性味咸、辛，平；归肝、肺、胃经。功能清热镇惊，化痰止咳，消肿散结。适用于高热惊风，痉挛抽搐，癫痫，急性咽炎，流行性腮腺炎，急、慢性支气管炎，荨麻疹，高脂血症等。研末内服，1.5～6g；或制成片剂用。本品的效用与僵蚕相近而药力较缓，可作僵蚕的代用品。2.雄蚕蛾本品为蚕蛾科昆虫家蚕蛾BombyxmoriLinnaeus的雄虫的全体。性味咸，温；归肝、肾经。功能补肾壮阳，涩精，止血，解毒消肿。适用于阳痿遗精，白浊，血淋，金疮出血，咽喉肿痛，口舌生疮，痈肿疮毒，冻疮，蛇伤等。研末内服，1.5～5g；或入丸剂用；外用适量。
337,开窍药,,麝香,《神农本草经》）,本品为鹿科动物林麝、马麝或原麝成熟雄体香囊中的干燥分泌物。主产于四川、西藏、云南。野麝多在冬季至次春猎取，猎获后，割取香囊，阴干，习称“毛壳麝香”；剖开香囊，除去囊壳，习称“麝香仁”。家麝直接从其香囊中取出麝香仁，阴干或用干燥器密闭干燥。本品气香浓烈而特异，味微辣、微苦带咸。以颗粒色紫黑、粉末色棕褐、质柔、油润、香气浓烈者为佳。用时研碎。,辛，温。归心、脾经。,开窍醒神，活血通经，消肿止痛。,"活血通经,消肿止痛",1.热病神昏，中风痰厥，气郁暴厥，中恶昏迷本品辛香温通，走窜之性甚烈，有极强的开窍通闭之功，可用于各种原因所致的闭证神昏，为醒神回苏之要药。无论寒闭、热闭，用之皆效，尤宜于寒闭神昏。用治温病热陷心包、痰热蒙蔽心窍、小儿惊风及中风痰厥等热闭神昏，常配伍牛黄、冰片、朱砂等，组成凉开之剂，如安宫牛黄丸（《温病条辨》）、至宝丹（《和剂局方》）；治中风卒昏、中恶胸腹满痛等寒浊或痰湿阻闭心窍之寒闭神昏，常配伍苏合香、檀香、安息香等药，组成温开之剂，如苏合香丸（《和剂局方》）。2.血瘀经闭，癥瘕，胸痹心痛，心腹暴痛，跌扑伤痛，痹痛麻木，难产死胎本品辛香，开通走窜，可行血中之瘀滞，开经络之壅遏，具有活血通经、止痛之功。用治血瘀经闭，常与丹参、桃仁、红花等药同用；若癥瘕痞块等血瘀重证，可与水蛭、虻虫、三棱等配伍，如化癥回生丹（《温病条辨》）；本品开心脉，祛瘀滞，为治心腹暴痛之佳品，常配伍川芎、三七、木香等；治偏正头痛，日久不愈者，常与赤芍、川芎、桃仁等配伍，如通窍活血汤（《医林改错》）。本品又为伤科要药，善于活血祛瘀、消肿止痛，治跌仆肿痛、骨折扭挫，常与乳香、没药、红花等配伍，如七厘散（《良方集腋》）、八厘散（《医宗金鉴》），无论内服、外用均可；用治风寒湿痹，疼痛不已，顽固不愈者，可配伍独活、威灵仙、桑寄生等祛风湿、通经络之品。此外，本品辛香走窜，力达胞宫，有活血通经、催生下胎之效，可用治难产死胎、胞衣不下，常与肉桂配伍，如香桂散（《张氏医通》）。3.痈肿，瘰疬，咽喉肿痛本品辛香行散，有良好的活血散结，消肿止痛作用，内服、外用均可。治疮疡肿毒，常与雄黄、乳香、没药同用，如醒消丸（《外科全生集》）；治咽喉肿痛，可与牛黄、蟾酥、珍珠等配伍，如六神丸（《中华人民共和国药典临床用药须知·中药成方制剂卷》2010年版）。,"安宫牛黄丸,苏合香丸,化癥回生丹,通窍活血汤,七厘散,香桂散,醒消丸,六神丸",0.03～0.1g，多入丸散用。外用适量。,孕妇禁用。,本品能改变血脑屏障的通透性，增强中枢神经系统的耐缺氧能力，改善脑循环，具有兴奋中枢、抗脑损伤、改善学习记忆作用。麝香还有明显的强心作用，能增强心肌收缩力和心排出量。麝香注射液可促进损伤神经的功能修复。麝香水剂具有扩血管作用。麝香酮能明显增加子宫收缩频率和强度，并有抗早孕和抗着床作用；麝香有一定的抗炎作用，其抗炎作用与氢化可的松相似；麝香还有抗肿瘤、免疫抑制等作用。,
338,开窍药,,冰片,《新修本草》）,本品为龙脑香科植物龙脑香树脂的加工品，或龙脑香树的树干、树枝切碎，经蒸馏冷却而得的结晶，称“龙脑冰片”，亦称“梅片”。由菊科植物艾纳香的新鲜叶经提取加工制成的结晶，称“艾片左旋龙脑”。现多用松节油、樟脑等，经化学方法合成，称“合成龙脑”。由樟科植物樟的新鲜枝、叶经提取加工制成，称天然冰片右旋龙脑。龙脑香主产于东南亚地区，我国台湾有引种；艾纳香主产于广东、广西、云南等地；天然冰片主产于江西、湖南。本品气清香，味辛、凉。以片大、色洁白、气清香纯正者为佳。研粉用。,辛、苦，微寒。归心、脾，肺经。,开窍醒神，清热止痛。,清热止痛,1.热病神昏，惊厥，中风痰厥，气郁暴厥，中恶昏迷本品味辛气香，有开窍醒神之功效，功似麝香但力较弱，二者常相须为用。因其性偏寒凉，为凉开之品，宜用于热病神昏。如治痰热内闭、热病神昏、暑热卒厥等热闭神昏，常与牛黄、麝香、黄连等配伍，如安宫牛黄丸（《温病条辨》）；若属寒闭神昏，常与苏合香、安息香、丁香等温开药配伍，如苏合香丸（《和剂局方》）。2.胸痹心痛本品入心经，止心痛，用治冠心病心绞痛，可与川芎或丹参等配伍，如速效救心丸、复方丹参滴丸（《中华人民共和国药典·一部》2015年版）。3.目赤肿痛，口舌生疮，咽喉肿痛，耳道流脓本品苦寒清热，有良好的泻火解毒、清热止痛之功，为五官科常用药。治疗目赤肿痛，单用点眼即可，或与炉甘石、硼砂、熊胆粉等制成点眼药水，如八宝眼药水（《全国中成药处方集》）；治疗咽喉肿痛、口舌生疮、牙龈肿痛，常与硼砂、朱砂、玄明粉等配伍，如冰硼散（《外科正宗》），或研细末，吹敷患处；治疗风热喉痹，《濒湖集简方》以之与灯心草、黄柏、白矾共为末，吹患处。治疗急、慢性化脓性中耳炎，可以本品搅溶于核桃油中滴耳。4.疮疡肿痛，久溃不敛，烧烫伤本品有清热解毒、防腐生肌作用。治疮疡溃后不敛，可配伍牛黄、珍珠、炉甘石等，如八宝丹（《疡医大全》），或与象皮、血竭、乳香等同用，如生肌散（《经验方》）；治烧烫伤，可与朱砂、香油制成药膏外用。,"安宫牛黄丸,苏合香丸,八宝眼药水,冰硼散,八宝丹,生肌散",0.15～0.3g，入丸散用。外用研粉点敷患处。,孕妇慎用。,本品对中枢神经系统具有兴奋和抑制双重作用，龙脑、异龙脑均有耐缺氧作用，并改善缺血脑组织能量代谢，减轻脑损伤；本品还能抗心肌缺血，局部应用对感觉神经有轻微刺激，有一定的止痛及温和的防腐作用；本品对金黄色葡萄球菌、乙型溶血性链球菌、草绿色链球菌、肺炎球菌和大肠杆菌等在试管内均有明显抗菌作用，呈现出低浓度抑菌，高浓度杀菌的作用；本品还能抗生育，并具有促进药物吸收、影响药物分布等作用。,
339,开窍药,,苏合香,《名医别录》）,本品为金缕梅科植物苏合香树的树干渗出的香树脂经加工精制而成。主产于土耳其、埃及、叙利亚，我国广西、云南亦产。初夏时将树皮击伤或割破，深达木部，使分泌香脂，渗入树皮内，至秋季剥下树皮，榨取香脂，残渣加水煮后再榨，除去杂质，再溶解于乙醇中，滤过，蒸去乙醇，即得。本品气芳香。以棕黄色或暗棕色、半透明、香气浓者为佳。生用。,辛，温。归心、脾经。,开窍醒神，辟秽，止痛。,,1.中风痰厥，猝然昏倒，惊痫本品辛香气烈，有开窍醒神之效，作用与麝香相似而力稍逊，且长于温通、辟秽，故为治面青、身凉、苔白、脉迟之寒闭神昏的要药。治疗中风痰厥，猝然昏倒，惊痫等属于寒邪、痰浊内闭者，常配伍麝香、安息香、檀香等，如苏合香丸（《和剂局方》）。2.胸痹心痛，胸腹冷痛本品温通、走窜，可收化浊开郁，祛寒止痛之效。用治寒凝气滞、心脉不通之胸痹心痛，可与冰片、檀香等配伍，如冠心苏合丸（《中华人民共和国药典·一部》2015年版）。治疗痰浊寒凝之胸脘痞满冷痛，常与冰片等同用，如苏合丸（《和剂局方》）。,"苏合香丸,冠心苏合丸,苏合丸",0.3～1g，宜入丸散服。,,本品具有穿透血脑屏障，兴奋中枢，抗缺氧等作用，并能对抗心肌梗死，增强耐缺氧能力，能减慢心率、改善冠脉流量和降低心肌耗氧的作用；苏合香脂有明显抗血小板聚集作用，苏合香还能明显延长血浆复钙时间和凝血酶原时间，降低纤维蛋白原含量和促进纤溶酶活性。苏合香有祛痰作用，并有较弱的抗菌作用，可用于各种呼吸道感染；可缓解局部炎症，促进溃疡与创伤的愈合，所含桂皮酸具有抗菌、防腐、利胆、止泻等作用。,附药：安息香本品为安息香科植物白花树Styraxtonkinensis（Pierre）CraibexHart.的干燥树脂。性味辛、苦，平；归心、脾经。功能开窍醒神，行气活血，止痛。适用于中风痰厥，气郁暴厥，中恶昏迷，心腹疼痛，产后血晕，小儿惊风。0.6～1.5g，多入丸散用。
